Unnamed: 0,Comment,Language,Sentiment
539,ayaw ayaw nyang tinatama example mali yung check quiz nagagalit,tlen,-1
540,puro reporting hindi nagtuturo nagtuturo sumusweldo lang,tlen,-1
541,laging absent yay,tlen,-1
542,mahilig magjoke gitna lecture marunong makisama students,tlen,1
543,maraming life lessons matututunan class,tlen,1
544,marunong magturo ginagawang compulsory recitation,tlen,-1
545,hindi nagrerespond email,tlen,-1
546,hours pinagkakasiya yung maraming lesson powerpoint slides minimum,tlen,-1
547,maraming visual guides gives additional points students reciting,tlen,1
548,bumili coke gate,tlen,0
549,nasosobrahan kwento tagal naming matapos chapter,tlen,-1
550,hindi namimigay nang points kinaiinisan estudyante,tlen,-1
551,teaching passion galing,tlen,1
552,maraming examples tinuturo nagbibigay equal chances recitation,tlen,1
553,hindi mawawala yung topic good virtues pag nagtuturo,tlen,1
554,maayos magpaquiz quiz tinuro sinabi need aralin,tlen,1
555,bigtime si sir,tlen,0
556,matalinong guro pwedeng kaibigan madaling lapitan favorite line ipagpepray kita anak kelangan competitive guys singko anak,tlen,1
557,sobrang naeengage pag nagtuturo,tlen,1
558,nagustuhan yung subject,tlen,1
559,pagka manyak sexual innuendos pag nagdidiscuss,tlen,-1
560,galing daming assignments seatworks nagegets,tlen,1
561,organized lectures sees nasusunod schedule pinost lecturequizswhw,tlen,1
562,madaling kausap prof,tlen,1
563,maraming incentives related rin naman course,tlen,1
564,feeling matalino di nakikinig suggestions students,tlen,-1
565,memorization lang yung subject networking,tlen,-1
566,mataas magbigay grade students,tlen,1
567,kaibigan labas nang klase professor loob nang klase,tlen,1
568,mahirap magpatest natuturo nang maigi parang dumadali yung tests,tlen,1
569,nagbibigay nang makeup test walang valid reason pagka absent nang estudyante,tlen,1
570,walang sinabi sinabi si david blaine harry potter dumbledore profna tom galing magmagic grades,tlen,-1
571,support evidences opinion stated lalo nag iincrease tiwala,tlen,1
572,dont know whats problem super sungit namemersonal,tlen,-1
573,magaling naman siyang magturo madaling lapitan kaso mahirap makipagsched meeting thesis kasi palaging busy,tlen,-1
574,magaling magturo pinagbibigyan estudyante magturo nagkakamali pag nagcorrect tinatanggap,tlen,1
575,pinapaenjoy yung subject students diverse pagturo,tlen,1
576,yung klase prof mahilig babae mas pinapaboran nga estudyante babae lalo maganda sure pass,tlen,-1
577,laging nakastarbucks,tlen,0
578,manyak doesnt follow schedules,tlen,-1
579,napakaganda nya di kumukupas walang araw di nagturo higit di nagpapaquiz mahirap laging sure pass,tlen,1
580,mentor time hindi lang basta teacher,tlen,1
581,boring magturo,tlen,-1
582,masaya magaling magturo yung tipong makukuha mo talaga yung lesson kasi ituturo yung possible examples pwedeng mag pop,tlen,1
583,parang hindi forte yung tinuturo hindi magaling subject magaling cisco,tlen,-1
584,hindi student concern rin status mo students regular rin ba failing grades,tlen,1
585,gives guide defense defense day makes laglag forn profs,tlen,-1
586,hindi ineentertain labas nang klase,tlen,-1
587,let students appreciate subject teaches di nambabagsak student,tlen,1
588,prof super nakakaconnect saming students,tlen,1
589,maraming kwento life nirerelate lessons interesting lessons,tlen,1
590,sinabi makanyang limitasyon nagkakaintindihan student professors,tlen,1
591,superman dami tinuturuan but manages know,tlen,1
592,nagdala si sir sobrang daming sardinas klase,tlen,0
593,not grade fairly puro tres singko lang,tlen,-1
594,strict nga wala pang substance wag magturo sir,tlen,-1
595,madalas man siyang late galing naman magturo sobra,tlen,1
596,accurate definite magturo hindi lang,tlen,1
597,finollow twitter,tlen,0
598,wala siyang pakialam nagchecheating,tlen,-1
599,handson estudyante,tlen,1
600,lagi mang late naiintindihan naman naming yung tinuturo,tlen,1
601,pwede kumain class,tlen,1
602,sense fashion mahilig fitted shirt jeans,tlen,1
603,visual magturo explain things application,tlen,1
604,prof ggss gandang ganda,tlen,-1
605,madalas late pinakita rin ganda history pilipinas mahusay talaga,tlen,1
606,lagi siyang nakikita naglalakad main building,tlen,0
607,puro basa ppt,tlen,-1
608,puro kwento joke nauubos yung time sana discussion,tlen,-1
609,mahusay guro makakarelate sinasabe nya,tlen,1
610,magaling sana magturo kaso palaging absent,tlen,-1
611,di nag papaattendance,tlen,-1
612,walang sense puro storya walang meaning hindi related lessons,tlen,-1
613,nagpapaexam hindi tinuturo,tlen,-1
614,kaming bata sir,tlen,-1
615,conducts survey kada buwan,tlen,0
616,concerned talaga students,tlen,1
617,pinagagawa yung checking nang test papers,tlen,-1
618,parati oras yung klase maarte format,tlen,-1
619,open ideas not great lessons minor masarap rin pasukan,tlen,1
620,paborito masaya mag turo si maam,tlen,1
621,siyang kapamilya never let,tlen,1
622,maarte magturo perfectionist,tlen,-1
623,nagjojoke hindi antukin yung buong klase discussion,tlen,1
624,magaling magturo namamahiya man palagi hindi pinapabayaan estudyante walang alam lecture,tlen,1
625,hindi fair mag grade,tlen,-1
626,pagtuturo yung papasagutin lang activity book minute minute klase meeting nagsasagot kayo makikita niyo siyang natutulog table,tlen,-1
627,nagbibigay reviewer pointers students,tlen,1
628,si robocop palagi lapel,tlen,0
629,anong tanong sagutin basta lesson,tlen,1
630,hindi nang hindi inexplain yung computation nang grades naming,tlen,-1
631,hindi binabasa yung pinapasa essays,tlen,-1
632,hanep galing di book memorize alam alam tinuturo,tlen,1
633,lagi nakangiti laging naagawan projector whiteboard marker,tlen,1
634,walang kabuhaybuhay magturo parang binabasa lang yung binigay handouts,tlen,-1
635,sobrasobra scope nang test tinuturo,tlen,-1
636,hindi naman nya nagagamit yung notes binibigay nya di rin kasi nagtuturo madami kaming tanong napakabobo rin,tlen,-1
637,deserve best prof award,tlen,1
638,wala siyang pake student,tlen,-1
639,mabait person hindi ganun kagaling magturo pwede kumbaga favorite line nita not,tlen,-1
640,magaling magturo laging prepared discussion,tlen,1
641,naguupload powerpoints makatulong review estudyante,tlen,1
642,laging time pumasok never absent never late,tlen,1
643,hindi masyadong natuturo yung lumalabas test,tlen,-1
644,good relationship students tropa tropa teaches guides well,tlen,1
645,mahirap magbigay proyekto nagpapahiya estudyante,tlen,-1
646,puro application walang namang tinuturo panay selfstudy,tlen,-1
647,tatawa lang kayo tatawa maubos time wala naman kayong natututunan :(,tlen,-1
648,nakalimutan lagi nasabi nya yung joke nya meeting,tlen,-1
649,magaling magturo patas mag grade,tlen,1
650,nagtuturo ibat ibang technique forms pinapatawa estudyante,tlen,1
651,hindi nagbibigay nang quiz pagalam hindi naming naiintindihan yung lesson,tlen,1
652,hindi natatakot mambagsak buong class,tlen,-1
653,hindi nakikinig suggestion student,tlen,-1
654,tinuturo estudyante lessons pang meetings meeting,tlen,-1
655,magaling mag turo alam mong pinagaralan di gumagamit slides madalas rin siyang magpaquiz mahirap naman,tlen,1
656,puro fun activities games,tlen,1
657,unbelievable stories medyo world,tlen,-1
658,hirap magpaquiz di naman nagtuturo,tlen,-1
659,dont know isasagot kasi wala naman akong alam klase im listening,tlen,-1
660,malimit siyang magtanong bagsak recitation,tlen,-1
661,tas quiz multiple choice kaso wala projector identification,tlen,-1
662,lagi sineset mood classroom ambiance,tlen,1
663,malabo magbigay requirements,tlen,-1
664,religion subject open ideas not traditional catholic beliefs,tlen,1
